{
  "schemaVersion": 1,
  "generator": {
    "name": "sveld",
    "version": "0.38.6",
    "svelteVersion": "5.57.1"
  },
  "total": 1,
  "components": [
    {
      "moduleName": "Button",
      "filePath": "component/Button.svelte",
      "source": {
        "start": {
          "line": 1,
          "column": 0
        },
        "end": {
          "line": 14,
          "column": 0
        }
      },
      "syntaxMode": "legacy",
      "scriptLanguage": "js",
      "props": [
        {
          "name": "type",
          "kind": "let",
          "type": "string",
          "typeSource": "default",
          "value": "\"button\"",
          "defaultValue": {
            "raw": "\"button\"",
            "kind": "literal",
            "value": "button"
          },
          "isFunction": false,
          "isFunctionDeclaration": false,
          "isRequired": false,
          "constant": false,
          "reactive": false,
          "source": {
            "start": {
              "line": 2,
              "column": 2
            },
            "end": {
              "line": 2,
              "column": 29
            }
          }
        },
        {
          "name": "primary",
          "kind": "let",
          "type": "boolean",
          "typeSource": "default",
          "value": "false",
          "defaultValue": {
            "raw": "false",
            "kind": "literal",
            "value": false
          },
          "isFunction": false,
          "isFunctionDeclaration": false,
          "isRequired": false,
          "constant": false,
          "reactive": false,
          "source": {
            "start": {
              "line": 3,
              "column": 2
            },
            "end": {
              "line": 3,
              "column": 29
            }
          }
        }
      ],
      "moduleExports": [],
      "slots": [
        {
          "name": null,
          "default": true,
          "fallback": "Click me",
          "slot_props": "Record<string, never>",
          "source": {
            "start": {
              "line": 12,
              "column": 2
            },
            "end": {
              "line": 12,
              "column": 23
            }
          }
        }
      ],
      "events": [
        {
          "type": "forwarded",
          "name": "click",
          "element": "button",
          "source": {
            "start": {
              "line": 10,
              "column": 2
            },
            "end": {
              "line": 10,
              "column": 10
            }
          }
        }
      ],
      "typedefs": [],
      "generics": null,
      "rest_props": {
        "type": "Element",
        "name": "button"
      },
      "contexts": []
    }
  ]
}
