{
  "schemaVersion": 1,
  "generator": {
    "name": "sveld",
    "version": "0.31.0",
    "svelteVersion": "5.55.0"
  },
  "total": 1,
  "components": [
    {
      "moduleName": "LegacyButton",
      "filePath": "src/LegacyButton.svelte",
      "source": {
        "start": { "line": 1, "column": 0 },
        "end": { "line": 13, "column": 0 }
      },
      "syntaxMode": "legacy",
      "scriptLanguage": "js",
      "props": [
        {
          "name": "label",
          "kind": "let",
          "description": "Label text",
          "isFunction": false,
          "isFunctionDeclaration": false,
          "isRequired": true,
          "constant": false,
          "reactive": false,
          "source": {
            "start": { "line": 3, "column": 2 },
            "end": { "line": 3, "column": 19 }
          }
        },
        {
          "name": "disabled",
          "kind": "let",
          "description": "Whether the button is disabled",
          "type": "boolean",
          "value": "false",
          "isFunction": false,
          "isFunctionDeclaration": false,
          "isRequired": false,
          "constant": false,
          "reactive": false,
          "source": {
            "start": { "line": 6, "column": 2 },
            "end": { "line": 6, "column": 30 }
          }
        }
      ],
      "moduleExports": [],
      "slots": [
        {
          "name": null,
          "default": true,
          "slot_props": "Record<string, never>",
          "source": {
            "start": { "line": 11, "column": 2 },
            "end": { "line": 11, "column": 10 }
          }
        }
      ],
      "events": [],
      "typedefs": [],
      "generics": null,
      "contexts": []
    }
  ]
}
