{
  "schemaVersion": 1,
  "generator": {
    "name": "sveld",
    "version": "0.38.6",
    "svelteVersion": "5.57.1"
  },
  "total": 2,
  "components": [
    {
      "moduleName": "Button",
      "filePath": "src/lib/components/Button.svelte",
      "source": {
        "start": {
          "line": 1,
          "column": 0
        },
        "end": {
          "line": 16,
          "column": 0
        }
      },
      "syntaxMode": "legacy",
      "scriptLanguage": "js",
      "props": [
        {
          "name": "text",
          "kind": "let",
          "description": "Button text",
          "type": "string",
          "typeSource": "default",
          "value": "\"Click me\"",
          "defaultValue": {
            "raw": "\"Click me\"",
            "kind": "literal",
            "value": "Click me"
          },
          "isFunction": false,
          "isFunctionDeclaration": false,
          "isRequired": false,
          "constant": false,
          "reactive": false,
          "source": {
            "start": {
              "line": 5,
              "column": 2
            },
            "end": {
              "line": 5,
              "column": 31
            }
          }
        },
        {
          "name": "size",
          "kind": "let",
          "description": "Button size",
          "type": "string",
          "typeSource": "default",
          "value": "\"medium\"",
          "defaultValue": {
            "raw": "\"medium\"",
            "kind": "literal",
            "value": "medium"
          },
          "isFunction": false,
          "isFunctionDeclaration": false,
          "isRequired": false,
          "constant": false,
          "reactive": false,
          "source": {
            "start": {
              "line": 10,
              "column": 2
            },
            "end": {
              "line": 10,
              "column": 29
            }
          }
        }
      ],
      "moduleExports": [],
      "slots": [],
      "events": [],
      "typedefs": [],
      "generics": null,
      "contexts": []
    },
    {
      "moduleName": "Input",
      "filePath": "src/lib/components/Input.svelte",
      "source": {
        "start": {
          "line": 1,
          "column": 0
        },
        "end": {
          "line": 14,
          "column": 0
        }
      },
      "syntaxMode": "legacy",
      "scriptLanguage": "js",
      "props": [
        {
          "name": "placeholder",
          "kind": "let",
          "description": "Input placeholder",
          "type": "string",
          "typeSource": "default",
          "value": "\"\"",
          "defaultValue": {
            "raw": "\"\"",
            "kind": "literal",
            "value": ""
          },
          "isFunction": false,
          "isFunctionDeclaration": false,
          "isRequired": false,
          "constant": false,
          "reactive": false,
          "source": {
            "start": {
              "line": 5,
              "column": 2
            },
            "end": {
              "line": 5,
              "column": 30
            }
          }
        },
        {
          "name": "value",
          "kind": "let",
          "description": "Input value",
          "type": "string",
          "typeSource": "default",
          "value": "\"\"",
          "defaultValue": {
            "raw": "\"\"",
            "kind": "literal",
            "value": ""
          },
          "isFunction": false,
          "isFunctionDeclaration": false,
          "isRequired": false,
          "constant": false,
          "reactive": true,
          "source": {
            "start": {
              "line": 10,
              "column": 2
            },
            "end": {
              "line": 10,
              "column": 24
            }
          }
        }
      ],
      "moduleExports": [],
      "slots": [],
      "events": [],
      "typedefs": [],
      "generics": null,
      "contexts": []
    }
  ]
}
