{
  "schemaVersion": 1,
  "generator": {
    "name": "sveld",
    "version": "0.35.0",
    "svelteVersion": "5.56.3"
  },
  "total": 2,
  "components": [
    {
      "moduleName": "RunesButton",
      "filePath": "src/RunesButton.svelte",
      "source": {
        "start": {
          "line": 1,
          "column": 0
        },
        "end": {
          "line": 15,
          "column": 0
        }
      },
      "syntaxMode": "runes",
      "scriptLanguage": "js",
      "props": [
        {
          "name": "label",
          "kind": "let",
          "typeSource": "unknown",
          "isFunction": false,
          "isFunctionDeclaration": false,
          "isRequired": true,
          "constant": false,
          "reactive": false,
          "source": {
            "start": {
              "line": 2,
              "column": 8
            },
            "end": {
              "line": 2,
              "column": 13
            }
          }
        },
        {
          "name": "onclick",
          "kind": "let",
          "typeSource": "unknown",
          "isFunction": false,
          "isFunctionDeclaration": false,
          "isRequired": true,
          "constant": false,
          "reactive": false,
          "source": {
            "start": {
              "line": 2,
              "column": 15
            },
            "end": {
              "line": 2,
              "column": 22
            }
          }
        },
        {
          "name": "value",
          "kind": "let",
          "bindable": true,
          "type": "string",
          "typeSource": "default",
          "value": "\"ready\"",
          "defaultValue": {
            "raw": "\"ready\"",
            "kind": "literal",
            "value": "ready"
          },
          "isFunction": false,
          "isFunctionDeclaration": false,
          "isRequired": false,
          "constant": false,
          "reactive": true,
          "source": {
            "start": {
              "line": 2,
              "column": 34
            },
            "end": {
              "line": 2,
              "column": 60
            }
          }
        },
        {
          "name": "onpress",
          "kind": "let",
          "typeSource": "unknown",
          "isFunction": false,
          "isFunctionDeclaration": false,
          "isRequired": true,
          "constant": false,
          "reactive": false,
          "source": {
            "start": {
              "line": 2,
              "column": 62
            },
            "end": {
              "line": 2,
              "column": 69
            }
          }
        }
      ],
      "moduleExports": [],
      "slots": [
        {
          "name": null,
          "default": true,
          "slot_props": "{ value: string }",
          "source": {
            "start": {
              "line": 13,
              "column": 2
            },
            "end": {
              "line": 13,
              "column": 33
            }
          }
        }
      ],
      "events": [],
      "typedefs": [],
      "generics": null,
      "rest_props": {
        "type": "Element",
        "name": "button"
      },
      "contexts": []
    },
    {
      "moduleName": "RunesGenericList",
      "filePath": "src/RunesGenericList.svelte",
      "source": {
        "start": {
          "line": 1,
          "column": 0
        },
        "end": {
          "line": 18,
          "column": 0
        }
      },
      "syntaxMode": "runes",
      "scriptLanguage": "ts",
      "props": [
        {
          "name": "items",
          "kind": "let",
          "type": "Item[]",
          "typeSource": "typescript",
          "isFunction": false,
          "isFunctionDeclaration": false,
          "isRequired": true,
          "constant": false,
          "reactive": false,
          "source": {
            "start": {
              "line": 5,
              "column": 4
            },
            "end": {
              "line": 5,
              "column": 9
            }
          }
        },
        {
          "name": "row",
          "kind": "let",
          "type": "Snippet<[item: Item]>",
          "typeSource": "typescript",
          "isFunction": false,
          "isFunctionDeclaration": false,
          "isRequired": true,
          "constant": false,
          "reactive": false,
          "source": {
            "start": {
              "line": 6,
              "column": 4
            },
            "end": {
              "line": 6,
              "column": 7
            }
          }
        }
      ],
      "moduleExports": [],
      "slots": [],
      "events": [],
      "typedefs": [],
      "generics": [
        "Item",
        "Item extends { id: string | number } = { id: string }"
      ],
      "contexts": []
    }
  ]
}
