{
  "schemaVersion": 1,
  "generator": {
    "name": "sveld",
    "version": "0.38.6",
    "svelteVersion": "5.57.1"
  },
  "total": 1,
  "components": [
    {
      "moduleName": "Button",
      "filePath": "src/button/Button.svelte",
      "source": {
        "start": {
          "line": 1,
          "column": 0
        },
        "end": {
          "line": 41,
          "column": 0
        }
      },
      "syntaxMode": "legacy",
      "scriptLanguage": "ts",
      "props": [
        {
          "name": "type",
          "kind": "let",
          "type": "\"button\"",
          "typeSource": "default",
          "value": "\"button\"",
          "defaultValue": {
            "raw": "\"button\"",
            "kind": "literal",
            "value": "button"
          },
          "isFunction": false,
          "isFunctionDeclaration": false,
          "isRequired": false,
          "constant": false,
          "reactive": false,
          "source": {
            "start": {
              "line": 27,
              "column": 2
            },
            "end": {
              "line": 27,
              "column": 38
            }
          }
        },
        {
          "name": "primary",
          "kind": "let",
          "type": "boolean",
          "typeSource": "default",
          "value": "false",
          "defaultValue": {
            "raw": "false",
            "kind": "literal",
            "value": false
          },
          "isFunction": false,
          "isFunctionDeclaration": false,
          "isRequired": false,
          "constant": false,
          "reactive": false,
          "source": {
            "start": {
              "line": 28,
              "column": 2
            },
            "end": {
              "line": 28,
              "column": 29
            }
          }
        }
      ],
      "moduleExports": [
        {
          "name": "tree",
          "kind": "const",
          "type": "boolean",
          "typeSource": "default",
          "value": "false",
          "defaultValue": {
            "raw": "false",
            "kind": "literal",
            "value": false
          },
          "isFunction": false,
          "isFunctionDeclaration": false,
          "isRequired": false,
          "constant": true,
          "reactive": false,
          "source": {
            "start": {
              "line": 2,
              "column": 2
            },
            "end": {
              "line": 2,
              "column": 28
            }
          }
        },
        {
          "name": "computeTreeLeafDepth",
          "kind": "function",
          "type": "(node: any) => any",
          "typeSource": "inferred",
          "isFunction": true,
          "isFunctionDeclaration": true,
          "isRequired": false,
          "constant": false,
          "reactive": false,
          "source": {
            "start": {
              "line": 4,
              "column": 2
            },
            "end": {
              "line": 13,
              "column": 3
            }
          }
        },
        {
          "name": "findParentTreeNode",
          "kind": "function",
          "description": "Finds the nearest parent tree node",
          "type": "(node: HTMLElement) => null | HTMLElement",
          "typeSource": "jsdoc",
          "isFunction": true,
          "isFunctionDeclaration": true,
          "isRequired": false,
          "constant": false,
          "reactive": false,
          "source": {
            "start": {
              "line": 19,
              "column": 2
            },
            "end": {
              "line": 23,
              "column": 3
            }
          }
        }
      ],
      "slots": [
        {
          "name": null,
          "default": true,
          "fallback": "Click me",
          "slot_props": "Record<string, never>",
          "source": {
            "start": {
              "line": 39,
              "column": 2
            },
            "end": {
              "line": 39,
              "column": 23
            }
          }
        }
      ],
      "events": [
        {
          "type": "forwarded",
          "name": "click",
          "element": "button",
          "source": {
            "start": {
              "line": 37,
              "column": 2
            },
            "end": {
              "line": 37,
              "column": 10
            }
          }
        }
      ],
      "typedefs": [],
      "generics": null,
      "rest_props": {
        "type": "Element",
        "name": "button"
      },
      "contexts": []
    }
  ]
}
